keyword,title,abstract,publication_date,first_author_display_name,last_author_display_name,institution_display_name,institution_country_code,relevant,justification,year
mold,The application of elastic auxiliary air bag imprinting technology to the development of linear gradient micro‐structure replication processes,"This study proposed an innovative imprinting process technology using an elastic auxiliary air bag imprinting mechanism, combined with poly(dimethylsiloxane) (PDMS) soft mold and UV–LED array photocuring equipment, to evenly imprint and reproduce a micro‐lens mold into a gradient micro‐lens structure in order to achieve linear gradient in micro‐structures. The structure defined by the proposed process technology is more continuous and smoother than that of the current semi‐conductor gray scale photomasking process technology. The process is simpler, faster, and less expensive and is a more effective option for satisfying the formation requirements of different structural heights. This study used pressure‐sensitive film to test and discuss gradient imprint force distribution. The test results suggested that different spring constants led to tilt impressions, which caused the PDMS soft mold to contact with the substrate surface at different pressures. The color depth distribution of the pressure‐sensitive film testing results indicated that the spring constant and pressure distribution were somewhat correlated. Hence, the height of structural formation can be controlled by different spring constants. Finally, SEM and surface profiler measurements suggested that different spring constants can result in different tilt degrees of the imprinting platform of air bag imprinting applications for the imprinting and reproduction of smooth, continuous micro‐lens array structures of different heights. Copyright © 2012 John Wiley &amp; Sons, Ltd.",2012-03-27,Y.‐C. Weng,Yung-Jin Weng,National Taiwan University,TW,yes,"Yes, the paper is relevant as it discusses an innovative imprinting process using a PDMS soft mold that enhances the production of micro-structures, which could be applicable in the manufacture of soft contact lenses. The research focuses on non-injection molded methods and offers insights into efficiency and structural control that can impact the industry's advancements.",2012
mold,"Soft, smart contact lenses with integrations of wireless circuits, glucose sensors, and displays","This study presents a soft, smart contact lens that provides real-time sensing for diabetes through a wireless display.",2018-01-05,Jihun Park,Joohee Kim,Ulsan National Institute of Science and Technology,KR,yes,"Yes, the paper is relevant. It discusses soft, smart contact lenses that integrate advanced technologies such as wireless circuits and glucose sensors, aligning with the client's interest in emerging technologies and innovation within soft contact lens manufacturing.",2018
mold,Design of polyurea networks containing anticancer and anti‐inflammatory drugs for dual drug delivery purposes,"Abstract Naproxen (Nap), a non‐steroidal anti‐inflammatory drug, and 5‐fluorouracil (5FU), an anticancer drug, were easily incorporated into a polyurea xerogel. Polyureas (PUr) were synthesized by one pot reaction via sol–gel chemistry. Soft segments were based on polyetheramine‐PEO and hard segments were based on a hexamethylene diisocyanate trimer (HDI). The final materials were characterized by Fourier transform infrared (FTIR) spectroscopy, small‐angle X‐ray scattering (SAXS), and differential scanning calorimetry (DSC). Polyurea can assume many forms revealing its versatility in terms of produced shapes. In good agreement with FTIR, SAXS studies showed a microphase separated structure arising from inter‐hard‐domain spacings, which remains unchanged after incorporation of the drugs. DSC analysis demonstrated that the PEO chain mobility was poorly affected after the drugs incorporation due to the solvation of the drugs through the network. The water uptake and the amount of drug released agree well, playing an important role for controlled Nap and 5FU release. This work opens positive perspectives for ocular drug delivery and wound management, due to the easy processability of the xerogel, which has high feasibility to be moldable as pharmaceutical devices for contact lenses and transdermal patches purposes containing distinct therapeutic agents.",2021-11-26,Mariane A. de Resende,Gabriele A. Pedroza,Universidade de Franca,BR,yes,"Yes, the paper is relevant as it discusses the design of polyurea networks for drug delivery, specifically focusing on their potential use in ocular drug delivery through contact lenses. The incorporation of anticancer and anti-inflammatory drugs into a moldable polyurea xerogel aligns with the client's interest in advanced technologies for soft contact lens manufacturing.",2021
mold,A contact lens with embedded sensor for monitoring tear glucose level,,2011-01-01,Huanfen Yao,Angela J. Shum,University of Washington,US,yes,"Yes, the paper is relevant. It discusses a contact lens with an embedded sensor for monitoring tear glucose levels, which aligns with the client's interest in emerging technologies and smart lenses. Understanding this research could provide insights into the integration of sensors in non-injection moulded contact lenses.",2011
injection,Applications of Hyaluronic Acid in Ophthalmology and Contact Lenses,"Hyaluronic acid (HA) is a glycosaminoglycan that was first isolated and identified from the vitreous body of a bull’s eye. HA is ubiquitous in the soft connective tissues of animals and therefore has high tissue compatibility for use in medication. Because of HA’s biological safety and water retention properties, it has many ophthalmology-related applications, such as in intravitreal injection, dry eye treatment, and contact lenses. Due to its broad range of applications, the identification and quantification of HA is a critical topic. This review article discusses current methods for analyzing HA. Contact lenses have become a widely used medical device, with HA commonly used as an additive to their production material, surface coating, and multipurpose solution. HA molecules on contact lenses retain moisture and increase the wearer’s comfort. HA absorbed by contact lenses can also gradually release to the anterior segment of the eyes to treat dry eye. This review discusses applications of HA in ophthalmology.",2021-04-24,Wan-Hsin Chang,Peiyi Liu,Yung Shin Pharmaceutical Industrial (Taiwan),TW,yes,"Yes, the paper is relevant as it discusses the applications of hyaluronic acid in contact lenses, highlighting its role in enhancing comfort and moisture retention. This aligns with the client's interest in innovative technologies in contact lens manufacturing, particularly in terms of material properties and potential therapeutic applications.",2021
injection,Ocular Concentrations of Mitomycin C Using Different Delivery Devices,"Hypotony and its sequelae are a frequent complication of trabeculectomies performed with mitomycin C (MMC), possibly related to intraocular toxicity of the substance. In an animal model with rabbits, we used different devices for the application of MMC and measured extra- and intraocular concentrations by HPLC. In addition, the concentrations of MMC remaining in the devices were determined. The devices were (1) a regular surgical sponge, (2) a scleral shield, (3) a presoaked soft contact lens, (4) a soft contact lens with MMC application, and (5) subconjunctival injection. Ocular concentrations of MMC were similar within the first 4 groups and were highest in the last. The measurements suggest that MMC penetrates intraocularly regardless of the device used. The variability of remaining MMC concentrations in the devices was lowest in the soft contact lenses suggesting an improved delivery system compared to the usually used surgical sponges.",1997-12-04,Holger Mietz,Michael Diestelhorst,,,yes,"Yes, the paper is relevant. It discusses the effectiveness of soft contact lenses as a delivery device for mitomycin C, specifically noting their improved performance in terms of MMC concentration retention compared to traditional methods, which aligns with the client's interest in emerging technologies in soft contact lens manufacturing and drug delivery.",1997
drug,Drug delivery through soft contact lenses.,"Clinical studies were conducted on 466 patients waiting for senile cataract surgery and receiving chloromycetin, gentamicin, or carbenicillin subconjunctivally and through New Sauflon 70 and New Sauflon 85 lenses. The aqueous drug levels were biologically estimated at various time intervals. Soft contact lenses provided significantly higher drug penetration than subconjunctival therapy. Both modes of treatment provided therapeutically effective levels against most of the common ocular pathogens for varying intervals of 2 to 12 hours.",1988-02-01,Manoj Jain,,,,yes,"Yes, the paper is relevant as it discusses drug delivery through soft contact lenses, demonstrating their effectiveness in providing higher drug penetration compared to traditional methods. This aligns with the client's interest in innovations in soft contact lens manufacturing and drug delivery technologies.",1988
drug,Soft contact lenses functionalized with pendant cyclodextrins for controlled drug delivery,,2008-12-07,Jose-Fernando Rosa dos Santos,Carmen Alvarez‐Lorenzo,Universidade de Santiago de Compostela,ES,yes,"Yes, the paper is relevant as it discusses soft contact lenses that are functionalized with cyclodextrins for controlled drug delivery, directly aligning with the client's interest in technologies for smart drug-delivery-enabled lenses. Additionally, the focus on a novel approach in lens functionality supports the exploration of innovative manufacturing techniques in the industry.",2008
drug,Surfactant-laden soft contact lenses for extended delivery of ophthalmic drugs,,2008-11-18,Yash Kapoor,Justin C. Thomas,University of Florida,US,yes,"Yes, the paper is relevant as it discusses surfactant-laden soft contact lenses designed for extended drug delivery, which aligns with the client's interest in innovative technologies for soft contact lens manufacturing and drug delivery systems.",2008
drug,Soft Contact Lenses as Drug Delivery Systems: A Review,"This review describes the role of contact lenses as an innovative drug delivery system in treating eye diseases. Current ophthalmic drug delivery systems are inadequate, particularly eye drops, which allow about 95% of the active substance to be lost through tear drainage. According to the literature, many interdisciplinary studies have been carried out on the ability of contact lenses to increase the penetration of topical therapeutic agents. Contact lenses limit drug loss by releasing the medicine into two layers of tears on either side of the contact lens, eventually extending the time of contact with the ocular surface. Thanks to weighted soft contact lenses, a continuous release of the drug over an extended period is possible. This article reviewed the various techniques to deliver medications through contact lenses, examining their advantages and disadvantages. In addition, the potential of drug delivery systems based on contact lenses has been extensively studied.",2021-09-14,I. Rykowska,Iwona Nowak,Adam Mickiewicz University in Poznań,PL,yes,"Yes, the paper is relevant. It discusses the role of soft contact lenses as drug delivery systems and highlights various techniques for medication delivery, which aligns with the client's interest in emerging technologies in contact lens manufacturing, particularly in drug delivery applications.",2021
drug,Development and Efficacy of a Drug-Releasing Soft Contact Lens,"The purpose of this study was to investigate the uptake and the release of antibiotics from a newly synthesized drug delivery hydrogel soft contact lens (SCL) using an ion ligand mechanism.The antibiotics used were Gatifloxacin (GFLX) and Moxifloxacin (MFLX). The uptake amount and the sustained-release kinetics of antibiotics were investigated in vitro, and were also compared with newly synthesized SCLs, etafilcon A and polymacon. The antibiotic concentrations in the cornea, aqueous humor, and crystalline lens, and the effect against bacterial proliferation were investigated in vivo using rabbit subjects. Additionally the drug release efficacy of the new SCL was compared with that of eye drop administrations.In vitro, antibiotic uptake was increased with the weight percent (wt%) of the anionic group, and the released amount of antibiotics was highest during the initial 1 hour period, which then decreased over the next 72 hours. The released antibiotics volume of the new SCLs was significantly higher throughout 72 hours than that of the other two materials, etafilcon A and polymacon (P < 0.01). Whereas in vivo, the concentrations found in the cornea and aqueous humor were higher than those for the eye drop groups (P < 0.05 or P < 0.01). Antibiotic release at those sites decreased over 72 hours. No bacterial populations were detectable in the group treated with the new SCL presoaked in antibiotics throughout the experimental periods.The new SCLs released the antibiotics over several days, and showed improved penetration into the eye, along with prevention of bacterial proliferation.",2013-03-05,Koji Kakisu,Toru Matsunaga,Toho University,JP,yes,"Yes, the paper is relevant. It discusses the development and efficacy of a drug-releasing soft contact lens, which aligns with the client's interest in emerging technologies in soft contact lens manufacturing, particularly those that enable drug delivery.",2013
drug,Advances in chemistry and composition of soft materials for drug releasing contact lenses,"Ocular drug delivery has always been a challenging feat to achieve in the field of medical sciences. One of the existing methods of non-invasive ocular drug delivery is the use of eye drops. However, drugs administered through these formulations have low bioavailability in the ocular system. This limitation can been overcome by using contact lenses as drug delivery vehicles. According to USA FDA definitions they can be categorized into two main categories-hard and soft contact lenses. Based on the material properties, hard contact lenses are mostly produced from polymers of acrylate monomers such as MMA (methyl methacrylate). These have the least water retention capacity, thereby, having minimal ability to diffuse oxygen into the corneal layer and are not ideal for long term use. Soft material contact lenses are flexible and are mainly hydrogel based. They have higher water retention capacities as compared to rigid contact lenses, which gives them the ability to transmit oxygen to the corneal layer. These hydrogel based soft materials are mainly produced from polymers of acrylate monomers such as HEMA (hydroxyethyl methacrylate) and found to be better for drug delivery contact lenses. These polymer-based soft materials have been efficiently modified in terms of their chemistry to achieve diverse physicochemical properties to produce efficient ocular drug delivery systems. However, complications such as drug leaching during storage and distribution, sterilisation, preservation of integrity of the lens and the possibility of surface roughness due to the incorporated drug molecules still need to be optimised. This review highlights the chemistries of various polymeric molecules through which physicochemical properties can be modified to achieve optimum drug loading and sustained release of the drug for application in the ocular system.",2020-01-01,Subir Chatterjee,Prashant Upadhyay,Indian Institute of Technology Kanpur,IN,yes,"Yes, the paper is relevant as it discusses advancements in the chemistry and composition of soft materials for drug-releasing contact lenses, which aligns with the client's interest in emerging technologies in soft contact lens manufacturing, particularly in drug delivery systems. Additionally, it addresses challenges and innovations that could influence manufacturing methods, including non-injection molded approaches.",2020
drug,Development of ocular drug delivery systems using molecularly imprinted soft contact lenses,"Recently, significant advances have been made in order to optimize drug delivery to ocular tissues. The main problems in ocular drug delivery are poor bioavailability and uncontrollable drug delivery of conventional ophthalmic preparations (e.g. eye drops). Hydrogels have been investigated since 1965 as new ocular drug delivery systems. Increase of hydrogel loading capacity, optimization of drug residence time on the ocular surface and biocompatibility with the eye tissue has been the main focus of previous studies. Molecular imprinting technology provided the opportunity to fulfill the above-mentioned objectives. Molecularly imprinted soft contact lenses (SCLs) have high potentials as novel drug delivery systems for the treatment of eye disorders. This technique is used for the preparation of polymers with specific binding sites for a template molecule. Previous studies indicated that molecular imprinting technology could be successfully applied for the preparation of SCLs as ocular drug delivery systems. Previous research, particularly in vivo studies, demonstrated that molecular imprinting is a versatile and effective method in optimizing the drug release behavior and enhancing the loading capacity of SCLs as new ocular drug delivery systems. This review highlights various potentials of molecularly imprinted contact lenses in enhancing the drug-loading capacity and controlling the drug release, compared to other ocular drug delivery systems. We have also studied the effects of contributing factors such as the type of comonomer, template/functional monomer molar ratio, crosslinker concentration in drug-loading capacity, and the release properties of molecularly imprinted hydrogels.",2014-08-12,Faezeh Tashakori-Sabzevar,Seyed Ahmad Mohajeri,Mashhad University of Medical Sciences,IR,yes,"Yes, the paper is relevant. It discusses the development of molecularly imprinted soft contact lenses for ocular drug delivery, which aligns with the client's interest in emerging technologies in soft contact lens manufacturing, particularly regarding innovative drug delivery systems.",2014
drug,Evaluation of commercial soft contact lenses for ocular drug delivery: A review,,2020-08-25,Xin Fan,Cesar Torres-Luna,Auburn University,US,yes,"Yes, the paper is relevant as it reviews commercial soft contact lenses specifically for ocular drug delivery, aligning with the client's interest in emerging technologies in soft contact lens manufacturing. Understanding drug delivery mechanisms could provide insights into advancements and applications of newly developed manufacturing methods, including non-injection moulded techniques.",2020
drug,Drug delivery through soft contact lenses: An introduction,"Current ophthalmic drug delivery systems are insufficient, specifically eye drops, which allow approximately 95% of the drug contained in the drops to be lost due to absorption through the conjunctiva or through the tear drainage. The use of soft contact lenses has been proposed as a method to deliver drugs to the eye in an efficient manner. The contact lenses restrict the drug from being lost to tear drainage by releasing the drug into two tear layers on either side of the contact lens, where it ultimately diffuses into the eye. By using loaded soft contact lenses, continuous drug release for extended period is possible. This paper focuses on the different methods of drug loading used throughout a polymer hydrogel.",2011-01-01,Amit Kumar,G Jha,,,yes,"Yes, the paper is relevant. It discusses drug delivery systems using soft contact lenses, which aligns directly with the client's interest in emerging technologies in soft contact lens manufacturing, particularly those involving drug delivery capabilities.",2011
drug,Preparation of a Molecularly Imprinted Soft Contact Lens as a New Ocular Drug Delivery System for Dorzolamide,"In the present work a series of imprinted (MIPs) and non-imprinted (NIPs) hydrogels were prepared using 2-hydroxyethyl methacrylate (HEMA) as a backbone monomer, ethylene glycol dimethacrylate (EGDMA) as a cross-linker monomer, methacrylic acid (MAA) as a functional monomer and dorzolamide (DZD) as the template molecule. Different concentrations of MAA (0, 100, 200, 400 mM) were used for preparation of NIPs. Two DZD: MAA molar ratios (1:8 and 1:4) and 400 mM MAA were also applied in imprinting process. The hydrogels (0.4 mm thickness) were synthesized by thermal polymerization at 50°C in 24h in a polypropylene mould. Then, the swelling and binding properties of hydrogels were evaluated in water. Their loading and releasing properties were also studied in NaCl 0.9% and artificial lachrymal fluid. The results showed that using MAA as co-monomer and applying molecular imprinting technique increased loading capacity of hydrogels. The optimized imprinted hydrogel (MIP1:4), prepared with 400 mM MAA and DZD: MAA molar ratio of 1:4, had the highest affinity for DZD and the greatest ability to control the release process in aqueous media. Our data indicated that the use of suitable co-monomer and applying a molecular imprinting technique had important influence on loading and releasing properties of hydrogels.",2013-05-01,B Malaekeh Nikouei,Seyedeh Atefeh Vahabzadeh,Mashhad University of Medical Sciences,IR,yes,"Yes, the paper is relevant. It discusses the preparation of molecularly imprinted soft contact lenses designed for ocular drug delivery, specifically focusing on the synthesis and properties of hydrogels, which aligns with the client's interest in emerging technologies in soft contact lens manufacturing and drug-delivery-enabled lenses.",2013
drug,A Multifunctional Smart Soft Contact Lens Device Enabled by Nanopore Thin Film for Glaucoma Diagnostics and <i>In Situ</i> Drug Delivery,"In this paper, we report a new power-free multifunctional soft contact lens device that can measure intraocular pressure (IOP), achieve extended drug delivery in situ, and detect glaucoma biomarkers, all within the same device. Experiments demonstrate that the contact lens sensor can detect Interleukin 12p70, one possible biomarker for glaucoma, in a concentration as low as 2 pg/ml in artificial tears. The sustained drug release of the contact lens device can last up to 30 days. In ex vivo tests using cadaver pig eyes, the sensor detected IOP in a range of 10-50 mmHg with excellent repeatability.",2019-07-22,Chao Song,Gil Ben‐Shlomo,Iowa State University,US,yes,"Yes, the paper is relevant as it explores innovative multifunctional contact lens technology capable of measuring intraocular pressure and delivering drugs in situ, aligning with the client’s interest in emerging technologies in soft contact lens manufacturing and smart lens applications. Furthermore, the mention of non-injection molded methods could relate to the manufacturing processes under consideration.",2019
drug,Improved release of triamcinolone acetonide from medicated soft contact lenses loaded with drug nanosuspensions,,2017-04-12,Eva García-Millán,Mónica Quintáns-Carballo,Universidade de Santiago de Compostela,ES,yes,"Yes, the paper is relevant as it addresses the release of a drug from medicated soft contact lenses, specifically through the use of drug nanosuspensions. This aligns with the client's interest in innovative manufacturing technologies and drug delivery systems for contact lenses.",2017
drug,Antibacterial layer-by-layer coatings to control drug release from soft contact lenses material,,2018-10-17,Diana Silva,Hermínio C. de Sousa,University of Lisbon,PT,yes,"Yes, the paper is relevant as it discusses antibacterial coatings for soft contact lenses, which pertains to innovations in material properties and drug delivery systems. This aligns with the client's interest in emerging technologies and non-injection moulding methods in soft contact lens manufacturing.",2018
